{
  "$schema": "https://json.schemastore.org/claude-code-marketplace.json",
  "name": "aidd-framework",
  "version": "1.0.0",
  "description": "Official plugin marketplace for the AI-Driven Development framework",
  "owner": { "name": "AI-Driven Dev" },
  "plugins": [
    {
      "name": "aidd-context",
      "version": "1.0.0",
      "source": "./plugins/aidd-context",
      "description": "Knowledge production: project bootstrap, project init, context generation, mermaid diagrams, learn, discovery",
      "strict": true,
      "metadata": { "recommended": true }
    },
    {
      "name": "aidd-dev",
      "version": "1.0.0",
      "source": "./plugins/aidd-dev",
      "description": "Code transformation: SDLC orchestrator, plan, assert, audit, review, test, refactor, debug, for-sure. Hosts agents.",
      "strict": true,
      "metadata": { "recommended": true }
    },
    {
      "name": "aidd-vcs",
      "version": "1.0.0",
      "source": "./plugins/aidd-vcs",
      "description": "External artifacts: commit, pull-request, release-tag, issue-create",
      "strict": true,
      "metadata": { "recommended": true }
    },
    {
      "name": "aidd-pm",
      "version": "1.0.0-rc.1",
      "source": "./plugins/aidd-pm",
      "description": "Product management (release candidate): ticket-info, user-stories-create, prd",
      "strict": true,
      "metadata": { "recommended": true }
    },
    {
      "name": "aidd-async-dev",
      "version": "1.0.0",
      "source": "./plugins/aidd-async-dev",
      "description": "Async development orchestration: turn ready issues into pull requests, then iterate on review feedback until a human takes over.",
      "strict": true,
      "metadata": { "recommended": false }
    },
    {
      "name": "aidd-refine",
      "version": "1.0.0",
      "source": "./plugins/aidd-refine",
      "description": "Meta-cognition: refine input through brainstorming, refine output through challenge and condensed communication mode.",
      "strict": true,
      "metadata": { "recommended": true }
    }
  ]
}
